status_id,status_message,link_name,status_type,status_link,status_published,num_likes,num_comments,num_shares46895347303_106474592753535,b'Knock knock. This isn\xe2\x80\x99t a setup for a joke. I\xe2\x80\x99m locked out of my house.',,status,,2010-10-24 14:30:54,1601,458,0
46895347303_158317994207726,b'You know who rocks? My Facebook fans. You guys are way better than my Friendster fans.',,status,,2010-10-23 12:36:22,2203,316,0
46895347303_123841644341338,"b'I was a little worried when I found a CD called the XX in Jack Jr.\xe2\x80\x99s room. After listening to it though, I realized he just has excellent taste in music.'",,status,,2010-10-22 12:36:05,668,149,0
46895347303_161622760527377,"b'Last chance to be my Rich Fan and win over $10,000. Don\xe2\x80\x99t get hypnotized by my dollar sign eyes. Be sure to register now and share with your friends. Remember, More Fans = More Cash!'",,status,,2010-10-21 13:25:24,1289,224,0
46895347303_127009624021397,b'When are they going to come out with an actual eye-phone? My retina wants to call people.',,status,,2010-10-20 11:00:15,1031,191,0
46895347303_162081770483683,b'I actually have two middle names.  In and The.',,status,,2010-10-19 12:22:45,1350,237,0
46895347303_162182270473484,"b'My ""Rich Fan"" jar has over $10,000 and there\'s only 1 week left to register and win.  But no rush, you\'ll only have a lifetime of regret eating away at you if you don\'t.'",b'Jack in the Box',link,https://www.facebook.com/jackinthebox/,2010-10-18 15:05:07,1082,165,0
46895347303_134569476593877,b'The finest grade of sandpaper should just be called \xe2\x80\x98paper.\xe2\x80\x99',,status,,2010-10-17 19:59:01,697,144,0
46895347303_135150736533916,"b'Happy National Boss Day, Bruce Springsteen.'",,status,,2010-10-16 19:46:03,818,109,0
46895347303_151895218185738,b'My doctor told me to put green food coloring in my breakfast. I\xe2\x80\x99m starting to question the credentials of Dr. Seuss.',,status,,2010-10-15 12:40:21,1256,149,0
46895347303_103858799681963,b'When clowns dress up as people do they wear fake human noses?',,status,,2010-10-14 10:14:02,917,209,0
46895347303_116107851782484,b'Fact: No one will question you if you are carrying a clipboard.',,status,,2010-10-13 14:57:04,1318,191,0
46895347303_166637486682536,b'I need an idea for a good office prank.',,status,,2010-10-12 11:13:20,394,701,0
46895347303_167020043308609,"b'I wonder if Columbus would\xe2\x80\x99ve used a navigation system, and if so, would he have gone with Snoop Dogg or Sean Connery as the voice?'",,status,,2010-10-11 10:39:52,584,294,0
46895347303_159508707402823,b'Happy 10/10/10! Or as they do it in Europe: 10/10/10.',,status,,2010-10-10 12:06:46,1455,124,0
46895347303_133766873339634,b'I ran into a Facebook friend at the Facebook movie. It was awkward because I forgot to write on his wall for his birthday.',,status,,2010-10-09 13:15:32,944,169,0
46895347303_166499793360393,"b'Don\xe2\x80\x99t forget you have to register to be my \xe2\x80\x9cRich Fan.\xe2\x80\x9d Winner gets a bunch of money. More fans = More cash. So share this with all your friends, regular and internet. http://on.fb.me/dC9acd'",b'Jack in the Box',link,http://www.facebook.com/jackinthebox,2010-10-08 13:15:23,497,81,0
46895347303_120267324696540,"b'Curly fry roller coaster.  Make it happen, Mr. Six Flags.'",,status,,2010-10-07 13:00:58,868,104,0
46895347303_136445349736033,"b""I remember when people said there'd be flying cars by 2010.  Well, at least someone invented luggage with wheels.""",,status,,2010-10-06 13:23:03,988,142,0
46895347303_123116151076276,"b'Wanna be my ""Rich Fan"" and win a bunch of cash?  Click this link for details.  Or tap on it if you got one of those fancy tapping screens. http://bit.ly/dC9acd'",b'Jack in the Box',link,http://www.facebook.com/jackinthebox,2010-10-04 17:31:27,624,114,0
46895347303_100323410034175,"b'When you think about it, Disneyland is really just a people trap set by a mouse.'",,status,,2010-10-03 13:26:56,1446,154,1
46895347303_157780477580651,"b""It's confirmed. Pressing hard on the remote control buttons does not make the batteries work.""",,status,,2010-10-02 13:42:27,704,95,0
46895347303_154657204565787,"b""Just think how much deeper the ocean would be if there weren't any sponges living in it.""",,status,,2010-10-01 13:21:24,512,71,0
46895347303_154604154573221,"b""I have a bone to pick with my grandma.  It's Ketchup.  Not Catsup.""",,status,,2010-09-30 12:41:55,296,97,0
46895347303_129860830397891,"b""Doing thumb curls.  I'm training to beat the world's fastest texting record.""",,status,,2010-09-29 12:07:08,199,63,0
46895347303_163338757010366,"b""So... what's the speed of dark?""",,status,,2010-09-28 14:02:49,291,141,0
46895347303_162490637098460,b'Tennis players get tennis elbow.  I get hamburger hand.',,status,,2010-09-27 12:16:45,258,75,0
46895347303_121098977944564,"b'Somewhere between the Hokey Pokey and the backwards-only skate, I decided it was time for a Slushie.'",,status,,2010-09-26 19:49:24,214,52,0
46895347303_154835511203310,"b'Ok, everyone has cell phones.  Why are there still telephone poles?'",,status,,2010-09-25 18:47:44,350,181,0
46895347303_156043144419930,b'Just got my personalized license plate in the mail: OMNOMNOM',,status,,2010-09-24 12:40:40,322,82,0
46895347303_111364802258173,b'I can moonwalk in reverse.',,status,,2010-09-23 16:02:07,322,80,0
46895347303_127867897265345,"b'Red Vines or Twizzlers?  And please note, there IS a correct answer here.'",,status,,2010-09-22 12:20:01,129,559,0
46895347303_119957328060138,b'I have a T-shirt with a picture of me wearing a shirt with a picture of me on it.  Infinite Jack loop.',,status,,2010-09-21 12:37:45,319,79,0
46895347303_156235017739461,"b'I\'m plugging famous movie quotes with my menu items.  Try it, it\'s fun: ""Frankly my dear, I don\'t give a churro."" ""To infinity and bacon."" ""You\'re so milkshake and you don\'t even know it.""'",,status,,2010-09-20 13:51:34,222,222,0
46895347303_160098887335872,"b'Last night I slept like a baby, I think I woke up every two hours.'",,status,,2010-09-19 13:06:08,317,67,0
46895347303_135413876505576,b'I believe the Viking that named Iceland and Greenland was colorblind.',,status,,2010-09-17 11:52:21,237,57,0
46895347303_148702608503932,"b'One of our accountants is a vegetarian, but I just busted her eating animal crackers.'",,status,,2010-09-16 15:59:11,498,70,0
46895347303_155630807788571,b'Someone applied for a job today as a curly fry straightener.  What???',,status,,2010-09-15 12:49:08,355,106,0
46895347303_108734165854055,b'Anyone want to join my Fantasy Jai Alai league?',,status,,2010-09-14 12:30:04,107,63,0
46895347303_149807985053241,b'Being. held. hostage. by. a. feral. cat. Bring. yarn. Lots. of. yarn.',,status,,2010-09-13 12:49:14,269,83,0
46895347303_143438209031941,b'I saw a shooting star last night.  It fired paintballs at me.',,status,,2010-09-12 15:58:22,183,53,0
46895347303_129972610383515,b'I need a catch phrase.  Suggestions?',,status,,2010-09-11 13:41:58,65,342,0
46895347303_151321144890844,"b""If chipmunks and squirrels unite into one super species, the 'squirmunk', things could get interesting.""",,status,,2010-09-10 11:38:53,182,51,0
46895347303_107648719295030,"b'Click here for a coupon for a FREE small Fry when you buy my new Pastrami Grilled Sandwich.  Cuz coupons make the world go round.  Like a record baby, right round.  Round round.'",b'Jack in the Box - Coupon - Free Small Fry with purchase of a Pastrami Grilled Sandwich.',link,http://coupon.jackinthebox.com/pastrami-free-fries/,2010-09-09 12:49:35,119,68,0
46895347303_124667784252467,"b'Why does office productivity decline from September through December?  Oh yeah, fantasy football season.'",,status,,2010-09-08 12:46:24,128,35,0
46895347303_152839394735691,b'I do Pastrami Grilled Sandwiches my way - with Artisan bread instead of rye.  I also do boardroom presentations my way - disco balls and live cobras.',b'Jack in the Box Commercial - New Pastrami Grilled Sandwiches',link,https://www.youtube.com/watch?v=O5DuPaAeC_w,2010-09-07 12:57:32,148,69,1
46895347303_159042314109817,"b""I'm going to wear white after Labor Day.  I'm not rebelling, I'm in a lawn bowling league.""",,status,,2010-09-06 13:18:50,148,41,0
46895347303_154785887881053,"b""I love the SNL Digital Shorts, but I bet I'd love SNL Digital Jean Shorts even more.""",,status,,2010-09-05 16:44:45,79,30,0
46895347303_136622316381868,"b""Sleepless in Seattle.  This has nothing to do with what I'm watching and everything to do with my wife having Restless Leg Syndrome.""",,status,,2010-09-04 13:55:39,121,52,0
46895347303_138696232840712,"b'My apologies to anyone I\'ve ever called a ""nag"" over text.  I meant ""nah.""  Stupid autospell.'",,status,,2010-09-03 13:15:22,150,45,0
46895347303_111059868950829,"b""If I were stuck on an elevator with the Dalai Lama, I'd ask him what the numbers on tennis balls mean.""",,status,,2010-09-02 12:11:35,98,65,0
46895347303_104625292930816,"b""I'd like to take a poll.  Have you or have you not seen The Goonies?""",,status,,2010-09-01 13:25:55,186,447,0
46895347303_149918041704387,"b""I stay away from things I can't spell.  Like vacuumming.""",,status,,2010-08-31 13:15:52,239,58,0
46895347303_130968956948684,"b'Dear Paper: Please stop cutting me.  Regards, Jack.'",,status,,2010-08-30 13:01:09,191,44,0
46895347303_143030542400750,"b""Doesn't understand why his wife needs to have all her makeup and perfume out on the bathroom counter when we have plenty of cabinets.  Can anyone explain this to me?""",,status,,2010-08-29 13:46:27,137,119,0
46895347303_147982678556453,"b'Read a magazine the other day and the pages smelled like cologne.  Take that, iPad.'",,status,,2010-08-27 14:51:20,388,50,0
46895347303_142924889080037,"b""I'm bringing back the low five.""",,status,,2010-08-26 12:27:09,203,94,0
46895347303_154199404591881,"b""Pillow Pets send the wrong message to children.  Like it's okay to rest your head on bears.""",,status,,2010-08-25 12:10:29,276,49,0
46895347303_112998265421919,"b""On the back and head first is not the most effective method to slide into third base, but that doesn't mean I don't want to see somebody try it.""",,status,,2010-08-24 12:05:25,88,22,0
46895347303_154143447933312,"b""I'm going an entire month without using exclamation marks.  Starting now!  I mean, now.""",,status,,2010-08-23 12:57:10,151,53,0
46895347303_148906515128408,b'Possum or Opossum?  Somebody please.',,status,,2010-08-22 16:28:07,67,142,0
46895347303_122091047840523,"b'In case anyone is wondering, I will NOT be judging American Idol next season.'",,status,,2010-08-21 16:17:13,173,90,0
46895347303_138210159553539,"b'Yes, the Summer blockbuster remakes of remakes are here!'",,status,,2010-08-20 11:50:39,72,44,0
46895347303_141596389213953,"b'First!!!!  Oh wait, no one cares.'",,status,,2010-08-19 12:27:13,244,53,0
46895347303_132898443420879,b'In the face.  In the faaaaaace.',,status,,2010-08-18 12:01:15,163,50,0
46895347303_111473658908313,b'I thought I had insomnia but then I woke up and realized I was just dreaming about having insomnia.',,status,,2010-08-17 11:30:25,187,44,0
46895347303_145909185438341,"b""Let's start one of those Facebook campaigns to get me to host SNL.  If I do, it's free Tacos every Cinco de Mayo.""",,status,,2010-08-16 11:15:15,612,99,0
46895347303_145427588818512,"b""The term 'strip mall' is a bit misleading, isn't it?""",,status,,2010-08-14 14:41:02,235,56,0
46895347303_139028042800558,"b'Read the woman\'s lips starting at the 16 second mark. I think she says, ""Gee whiz, Jack in the Box serves their entire menu all day. Look how high I can lift my right leg."" http://www.youtube.com/watch?v=4nEsshq4HhA'","b""McDonald's Nugget Attack BY CRAZY WOMEN""",video,https://www.youtube.com/watch?v=4nEsshq4HhA,2010-08-13 16:37:29,258,103,5
46895347303_130754916969744,"b'""Tug of War"" is kind of a harsh name.  Shouldn\'t it just be called the ""Pull the Rope Game""?'",,status,,2010-08-12 14:16:19,112,41,0
46895347303_117464628306476,"b""I thought octogenarians were a variety of octopus.  Turns out they're just old people.""",,status,,2010-08-11 13:11:02,115,38,0
46895347303_150751548268724,"b'Wanna work for me?  Click my Careers Page.  Sorry, but the position of Handsome Founder of Jack in the Box has already been filled.'",b'Jack in the Box Careers',link,https://www.facebook.com/JackintheBoxCareers/,2010-08-10 12:29:10,74,45,0
46895347303_109383639115593,b'New discovery: Auto Tune turns boring speeches into amazing speeches.',,status,,2010-08-09 12:40:43,91,22,0
46895347303_118564768192660,"b""I've never crowd surfed.  I have, however, crowd boogie-boarded.""",,status,,2010-08-08 13:30:52,99,28,0
46895347303_143674725662618,"b""I prefer dog naps to cat naps.  They're longer and you get to move your legs like you're running when you dream.""",,status,,2010-08-07 17:50:27,288,33,0
46895347303_129042320474232,b'My entire menu is always yours for the taking.  So is that couch in my basement.  But you gotta come take it away.',,status,,2010-08-06 12:55:59,68,43,0
46895347303_118383411544100,b'Company foosball tournament this Friday.  No spinnies or jammies.  You know who you are.',,status,,2010-08-05 13:20:21,74,35,0
46895347303_148160068529187,"b""Is it a desert island?  Or a deserted island?  BIG debate here at the office, i.e. we're really busy.""",,status,,2010-08-04 15:35:10,75,74,0
46895347303_133941586647127,"b""I'm not sure if I'm half-training for a full marathon or fully training for a half-marathon.  Either way, it's horrible.""",,status,,2010-08-03 12:56:10,114,38,0
46895347303_136521746386414,"b""Take my Raspberry Trio Quiz to find out which of my new drinks is right for you, and get a coupon for $1 off.  Just click my page and then the Quizzes tab.  Don't worry, you can't fail it.""",,status,,2010-08-02 11:38:11,40,23,0
46895347303_102237419833550,b'I bet ants come back in their next lives as magnifying glasses.',,status,,2010-08-01 20:21:32,137,34,0
46895347303_132941650080307,b'Women wear slippers.  Men wear house shoes.  My dad has taught me many things.',,status,,2010-07-31 10:54:25,101,38,0
46895347303_132818916759563,"b""Jersey Shore in Miami Beach.  Can't. Not. Watch.""",,status,,2010-07-29 19:55:51,73,62,0
46895347303_129657963744881,"b'Salt or Pepper.  If you were stranded on a desert island and could only have one, which would it be?'",,status,,2010-07-28 18:13:19,47,317,0
46895347303_136075983099433,b'Why is the vibration on my phone louder than the ring?',,status,,2010-07-27 19:00:36,196,54,0
46895347303_138304112866537,"b'I wonder if Eminem eats M&Ms.  And if so, what are his feelings on the new pretzel kind?  These are the things that go on in my mind...'",,status,,2010-07-26 13:52:47,180,67,0
46895347303_146847298662098,"b'Sorry for that last post, my son hijacked my account.'",,status,,2010-07-25 15:49:20,142,61,0
46895347303_137610286271293,b'Monkey butts!!!',,status,,2010-07-25 15:48:55,137,43,0
46895347303_118392531542017,"b""Just found out my dog's left-handed.  Or, left-pawed as it were.""",,status,,2010-07-24 18:13:50,97,35,0
46895347303_144837208861471,b'Company softball game tonight and I lost one of my stirrups.  How am I supposed to hit a 5mph looping ball without a matching softball sock?!',,status,,2010-07-23 12:01:43,53,33,0
46895347303_114898638559762,b'They should really spell it the boredroom. *Yawn*.',,status,,2010-07-22 12:15:20,145,19,0
46895347303_125334534177344,"b""Those who live in glass houses shouldn't throw stones or breathe too heavily.  It fogs up.""",,status,,2010-07-21 11:59:56,172,35,0
46895347303_104241812964044,"b'How many fonts do we really need on computers?  Although, Zapfino will really come in handy if I ever need to email a pirate.'",,status,,2010-07-20 12:25:21,132,39,0
46895347303_124895987555615,"b""Lasers.  That's all I'm saying for now.""",,status,,2010-07-19 12:28:40,89,50,0
46895347303_144204428928877,b'Does ranch dressing go with everything?  Or is it that everything goes with ranch dressing?',,status,,2010-07-18 11:56:45,191,102,0
46895347303_139826439368903,b'I dominated the go-cart track last night and then got kicked out for doing doughnuts.  I have no regrets.',,status,,2010-07-17 11:52:32,217,35,0
46895347303_138459949512715,"b""I've never lost a staring contest.  Like any superhero, it is my gift as well as my curse.""",,status,,2010-07-16 13:00:32,112,30,0
46895347303_138640842831316,b'Sweet! I have my first stalker.',,status,,2010-07-15 13:35:03,150,78,0
46895347303_143779492302541,b'Giving vuvuzelas to everybody in the office was clearly a bad idea.',,status,,2010-07-14 12:35:56,158,45,0
46895347303_115627408484964,"b""New word combo.  Sauce that's awesome - Saucesome.""",,status,,2010-07-13 14:21:15,177,36,0
46895347303_136250376397664,"b""Whatever you're doing right now, you should probably hit Save.  You're welcome.""",,status,,2010-07-12 12:43:21,160,42,0
46895347303_109620432422730,"b""Last night I made an amazing chicken sandwich for a midnight snack.  I called it: Jack's Poultrygeist.""",,status,,2010-07-11 16:47:23,167,47,0
46895347303_137795636248461,"b'A firm handshake says a lot about a person.  Like, I can squeeze things tightly.'",,status,,2010-07-10 12:28:34,152,39,0
46895347303_135991499757728,"b""If I saw a double rainbow, I'd go hunting for a double pot of gold.  Then I'd mail that gold off to Cash 4 Gold.""",,status,,2010-07-09 16:00:27,182,34,0
46895347303_136423109720582,b'Jack Jr. is growing a futbol faux hawk.  Kids...',,status,,2010-07-08 12:15:17,59,28,0
46895347303_134727276550527,b'A dingo ate my cheeseburger.',,status,,2010-07-07 13:15:23,196,85,0
46895347303_130889640285269,"b""Hey, sign up for my Secret Society of Cool People and receive exclusive information and offers directly from me.  You'll also get to tell people you're part of a secret society, which most secret societies frown upon.""",b'Jack in the Box - RSVP',link,http://bit.ly/9xA1v5,2010-07-06 11:34:55,106,47,0
46895347303_137533719605449,"b""What's the best karaoke song of all time?""",,status,,2010-07-05 15:00:46,30,225,0
46895347303_130027827032376,"b'On a day where we celebrate our independence, why am I trapped at my in-laws?'",,status,,2010-07-04 16:41:13,224,51,0
46895347303_135061709850941,"b'--- .-. ... . -.-. ... -.. .  That\'s Morse Code for ""Morse Code.""'",,status,,2010-07-03 12:40:58,179,53,0
46895347303_134367823251814,"b""I'm not superstitious.  Just stitious.""",,status,,2010-07-01 13:10:37,143,45,0
46895347303_106466089405178,b'Use this coupon to get a FREE Mini Funnel Cake when you buy a Really Big Chicken Sandwich Combo.  I think I hear the faint sound of your taste buds clapping.',b'Jack in the Box - Coupon - Free Mini Funnel Cake with purchase of $3.99 Really Big Chicken Sandwich.',link,http://bit.ly/dkKoCA,2010-06-30 12:28:37,93,63,0
46895347303_139115439439082,"b'Jury duty.  A serious thing that just happens to have the word ""duty"" in it.'",,status,,2010-06-29 12:11:55,138,42,0
46895347303_105060389544665,"b""Feel my forehead.  Do I feel hot to you?  Oh man I hope it's not.... Bieber Fever.""",,status,,2010-06-26 13:45:00,167,79,0
46895347303_119195088124526,"b""I'm lost without LOST.  Yeah, I said it.""",,status,,2010-06-25 13:59:31,137,59,0
46895347303_127313110638023,"b""Leather seats get hot in the summer.  That's why the interior of my car is made entirely of seersucker.  My favorite breathable fabric, second only to linen.""",,status,,2010-06-24 13:43:21,95,44,0
46895347303_137632129583084,b'Muscle Milk is totally misleading.  It tastes nothing like muscles.',,status,,2010-06-23 12:29:08,105,39,0
46895347303_103771379672928,"b""I'm glad that whole Virtual Reality thing never caught on.  It'd be a strange world where people are staring into computer screens all day.  Oh, wait.""",,status,,2010-06-22 12:14:37,181,39,0
46895347303_136925959655240,"b'I scream.  You scream.  We all scream for sunscreen.  Well, that and ice cream.  But seriously people, UV rays are no joke.'",,status,,2010-06-21 11:59:46,187,44,0
46895347303_137649642912564,"b""Happy Father's Day to all the Dads.  We didn't even have to give birth and we still get a day.""",,status,,2010-06-20 12:01:23,227,42,0
46895347303_128664040498976,"b'Kind of disappointed once I realized the Salsa lessons my wife signed us up for involve dancing, not sauce.'",,status,,2010-06-19 11:04:58,223,41,0
46895347303_136432049701840,b'Who is Earl Grey and why is he so delicious?',,status,,2010-06-18 12:16:52,137,60,0
46895347303_128123410553811,"b""If I had a cat, I'd make it wear corduroy pants so I'd always hear it coming.""",,status,,2010-06-17 15:46:53,247,62,0
46895347303_135340699815870,"b'Is it me, or do all Haikus sound like Yoda wrote them?'",,status,,2010-06-16 14:16:16,179,70,0
46895347303_135235033155619,b'Never trust a surgeon if you can beat them at the game of Operation.',,status,,2010-06-15 12:13:21,248,44,0
46895347303_125319987506543,"b'I just invented a new knot, I call it the Triple Jack Hitch.  It involved three pieces of rope and a cheeseburger.  The cheeseburger had nothing to do with the knot, I was just hungry.'",,status,,2010-06-14 14:18:27,135,34,0
46895347303_101264003259430,b'My entire menu is available anytime. I am not. So please stop facebooking me at 2am.',,status,,2010-06-13 12:05:38,220,77,0
46895347303_124437684259394,"b'The company bocce ball tournament begins today. Get your balls ready, people.'",,status,,2010-06-12 12:52:09,93,46,0
46895347303_115009895210107,b'GOOOOOOOOOOOOOOOOOOOOOOOOOOOAAAAAAAAAAAAAAALLLLLLLLL!\nFacebook.com/soccerjack',,status,,2010-06-10 12:21:09,82,40,0
46895347303_126119324088562,"b'Would people still eat ladyfingers for dessert if they were called ""manfingers""?'",,status,,2010-06-09 12:05:58,110,86,0
46895347303_123422991028756,"b'Starting a petition for a ""so-so"" hand button on Facebook.  Cuz sometimes I don\'t like or dislike something.  But I still feel the need to comment on it.'",,status,,2010-06-08 12:06:52,335,71,0
46895347303_110311722349012,"b""BOO!!!!  In case anyone out there had the hiccups.  You're welcome.""",,status,,2010-06-07 12:05:06,149,40,0
46895347303_132836943398991,b'What if we had eyecubes instead of eyeballs?',,status,,2010-06-06 19:49:47,128,96,0
46895347303_129462793746290,"b""I'm thinking pigeons should have their flight privileges revoked.""",,status,,2010-06-05 14:46:38,208,54,0
46895347303_134105356603161,"b""I'm typting with my elsbows 'cuz I can.  Wellk, sorrt of.""",,status,,2010-06-04 12:15:19,103,40,0
46895347303_122259747811033,b'Two major things I wanted to accomplish in my life: Serve my entire menu all day and battle a giant octopus.  Check and check.',,status,,2010-06-03 12:25:04,140,50,0
46895347303_122170787823565,b'Love is in the air.  And so is the smell of bacon.',,status,,2010-06-02 12:13:04,266,90,0
46895347303_123417011025955,b'Stuck in a turtleneck. Need. Help.',,status,,2010-05-30 11:36:38,180,80,0
46895347303_130589680289492,b'The key to inner peace is to become one with yourself. The key to Nintendo\xe2\x80\x99s Contra? Up Up Down Down Left Right Left Right B A Start.',,status,,2010-05-28 12:33:37,202,56,0
46895347303_120533441316698,"b'I\xe2\x80\x99m writing this status update with a British accent. It\xe2\x80\x99s jolly good, yes?'",,status,,2010-05-27 11:10:13,190,79,0
46895347303_120251218013903,"b""WEDNESDAY WEDNESDAY WEDNESDAY!!!!  Hmm, yeah that doesn't work as well as Sunday Sunday Sunday, does it?""",,status,,2010-05-26 14:34:17,77,48,0
46895347303_128900053792862,"b""My stomach is talking to me, but I'm not sure what it's saying.  I'm still learning to speak stomach.""",,status,,2010-05-25 12:29:15,129,69,0
46895347303_125858987439934,"b'Just had a new Grilled Breakfast Sandwich and a cup of Kona Classic\xc2\xae coffee at one of my restaurants.  And just so you know, Jack Box likes this.'",b'New Jack in the Box Commercial - Grilled Breakfast Sandwich',link,https://www.youtube.com/watch?v=bMJDM9u-TKU,2010-05-24 12:44:20,112,40,0
46895347303_126487674044369,"b""There's a part of me that wants to ride a barrel over Niagara Falls.  But there's a bigger part of me that says, oh hell no.""",,status,,2010-05-23 15:10:16,223,67,0
46895347303_101687783212533,b'1970. 1990. 2010.  Apparently every 20 years it becomes okay for guys to wear jean shorts.',,status,,2010-05-22 14:21:49,131,90,0
46895347303_120746871293301,b'Decided to grow playoff hockey sideburns because a beard is too expected.',,status,,2010-05-21 11:28:51,73,35,0
46895347303_123018401051952,"b""Sneakers, tennis shoes or gym shoes?  What do you call 'em?""",,status,,2010-05-20 13:43:11,43,249,0
46895347303_122934377736668,b'Just dropped smoothie on computer.  Anyone know how to get it out without damaging the smoothie?',,status,,2010-05-19 12:51:47,170,73,0
46895347303_104344622945279,"b""Just got an email from a lovely Nigerian fellow who wants to share his 300 million dollar inheritance with me.  All I need to do is send him my bank account and social security numbers.  It's my lucky day!""",,status,,2010-05-17 12:54:01,290,135,0
46895347303_122053281148946,"b""Go shorty, it's my birthday.""",,status,,2010-05-16 19:27:10,272,105,0
46895347303_117512311621694,b'My entire menu.  Eat it anytime.  Even during Hammer time.',,status,,2010-05-15 13:02:19,188,56,0
46895347303_118942548140722,"b'Wrestling bear with one hand, typing with other.'",,status,,2010-05-14 13:25:58,162,67,0
